{
  "$schema": "https://json-schema.org/draft/2020-12/schema",
  "$id": "https://fsrs.local/schemas/v4/verified_player.schema.json",
  "title": "FSRS v4 verified_player",
  "type": "object",
  "required": [
    "schemaVersion",
    "recordType",
    "recordId",
    "createdAt",
    "provenance"
  ],
  "properties": {
    "provenance": {
      "type": "object"
    },
    "identity": {
      "type": "object"
    },
    "currentStatus": {
      "type": "object"
    },
    "contracts": {
      "type": "object"
    },
    "verifiedMetrics": {
      "type": "object"
    },
    "dataQuality": {
      "type": "object"
    },
    "schemaVersion": {
      "type": "string"
    },
    "recordType": {
      "const": "verified_player"
    },
    "recordId": {
      "type": "string"
    },
    "createdAt": {
      "type": "string"
    },
    "status": {
      "type": "string"
    },
    "canonicalPlayerId": {},
    "metricObservationRefs": {
      "type": "array"
    },
    "conflicts": {
      "type": "array"
    }
  },
  "additionalProperties": false
}
