{
  "schemaVersion": "4.0.0",
  "recordType": "verified_player",
  "recordId": "mg-verified-example",
  "createdAt": "2026-07-24T00:00:00Z",
  "status": "PUBLISH_WITH_WARNINGS",
  "provenance": {
    "disclaimer": "Bu değerler yalnızca mimari örnektir; güncel veya doğrulanmış Mason Greenwood verisi değildir."
  },
  "canonicalPlayerId": "player-mason-greenwood-example",
  "identity": {
    "displayName": "Mason Greenwood"
  },
  "currentStatus": {},
  "contracts": {},
  "metricObservationRefs": [],
  "verifiedMetrics": {},
  "conflicts": [],
  "dataQuality": {
    "confidence": 0.88
  }
}
