{
  "schemaVersion": "4.0.0",
  "recordType": "verified_player",
  "recordId": "verified-example",
  "createdAt": "2026-07-24T00:00:00Z",
  "status": "BLOCKED",
  "provenance": {},
  "canonicalPlayerId": null,
  "identity": {},
  "currentStatus": {},
  "contracts": {},
  "metricObservationRefs": [],
  "verifiedMetrics": {},
  "conflicts": [],
  "dataQuality": {}
}
